{
  "title": "Bài học cuộc sống từ một tháng ăn thịt gà",
  "plot_summary": "Trong một tháng, một người đàn ông chỉ ăn thịt gà. Anh ta nói rằng anh ta không biết làm gì khác. Anh ta nói rằng anh ta không biết làm gì khác vì anh ta không có tiền để mua thức ăn khác. Anh ta nói rằng anh ta không biết làm gì khác vì anh ta không có tiền để mua thức ăn khác. Anh ta nói rằng anh ta không biết làm gì khác vì anh ta không có tiền để mua thức ăn khác.",
  "moral_lesson": "Đừng vì thiếu tiền mà bỏ qua cơ hội tốt đẹp. Hãy cố gắng hết sức để kiếm tiền, đừng để tiền làm bạn mất đi mục tiêu của mình.",
  "segments": [
    {
      "segment_id": 1,
      "source_start": "00:02:15.527",
      "source_end": "00:02:36.846",
      "script_text": "Tuyền bà cá thì anh chỉ cũng không có như giả gì a cartoon character and a woman in a room"
    },
    {
      "segment_id": 2,
      "source_start": "00:03:49.602",
      "source_end": "00:03:56.724",
      "script_text": "Đôi chả có gì bỏ vụng làm sao a cartoon character sitting on the ground"
    }
  ]
}
