{
  "title": "Video Summary",
  "plot_summary": "Noi dung cho thay dien bien theo thu tu thoi gian voi hinh anh chinh la 'a cartoon picture of two men eating food' va hoi thoai noi bat la 'Một tháng, ăn thịt gà'.",
  "moral_lesson": "Thong diep duoc rut ra tu cac su kien da xuat hien trong video.",
  "segments": [
    {
      "segment_id": 1,
      "source_start": "00:00:02.500",
      "source_end": "00:00:05.500",
      "script_text": "Một tháng, ăn thịt gà"
    },
    {
      "segment_id": 2,
      "source_start": "00:11:15.240",
      "source_end": "00:11:18.240",
      "script_text": "Trời, cho em giám đi một mình ra ngoài bia đơn"
    },
    {
      "segment_id": 3,
      "source_start": "00:25:43.000",
      "source_end": "00:25:46.000",
      "script_text": "Hãy like, comment, subscribe con để xem thêm những video mới nhất nhé."
    }
  ]
}
