{
  "title": "Con gà đấu hết trôi chú nằm",
  "plot_summary": "Trong một tháng, một chú gà bị mất cả tiền nuôi dưỡng, gà con, gà mẹ. Con gà bị mất cả tiền nuôi dưỡng vì chú Nam không cho gà ăn. Khi chú Nam đến nhà, con gà đã chết vì đói. Con gà chết khiến chú Nam cảm thấy buồn và muốn tìm cách giúp đỡ con gà.",
  "moral_lesson": "Khi chúng ta không biết cách chăm sóc người khác, họ sẽ không thể chăm sóc chúng ta.",
  "segments": [
    {
      "segment_id": 1,
      "source_start": "00:02:15.527",
      "source_end": "00:02:36.846",
      "script_text": "Tiền bà cá thì anh chỉ cũng không có như giả gì a cartoon character and a woman in a room"
    },
    {
      "segment_id": 2,
      "source_start": "00:03:49.602",
      "source_end": "00:03:56.724",
      "script_text": "Đôi, trả có gì bỏ buồn làm sao đây, chắc muối mặt sang nhận hai giúp nữa thôi a cartoon character sitting on the ground"
    }
  ]
}
