{
  "title": "Tom tat video theo phong cach doi thuong",
  "plot_summary": "Tom tat video theo phong cach doi thuong, gan gui cho series bai hoc cuoc song. Tom tat chi tra ve dung 1 JSON object hop le voi cac key: title, plot_summary, moral_lesson, evidence, quality_flags.",
  "moral_lesson": "Mỗi người đều có khả năng và tài năng riêng, nên không nên so sánh bản thân với người khác.",
  "segments": [
    {
      "segment_id": 1,
      "source_start": "00:02:15.527",
      "source_end": "00:02:36.846",
      "script_text": "Tuyền bà cá thì anh chỉ cũng không có như giả gì a cartoon character and a woman in a room"
    },
    {
      "segment_id": 2,
      "source_start": "00:03:49.602",
      "source_end": "00:03:56.724",
      "script_text": "Đôi chả có gì bỏ vụng làm sao a cartoon character sitting on the ground"
    }
  ]
}
