{
  "title": "Video am ap viet tom tat ve con dao",
  "plot_summary": "Trong video này, một người đàn ông đang ngồi ăn cơm và nói rằng \"Một tháng, ăn thịt gà\". Sau đó, người đàn ông này nói rằng \"Tất cả là thật không phải mơ\". Người đàn ông này còn nói rằng \"Không biết có sao không nữa\". Người đàn ông này còn nói rằng \"Thế là sao\". Người đàn ông này còn nói rằng \"Thế là sao\".",
  "moral_lesson": "Cần phải làm việc chân chính, không nên lừa dối người khác.",
  "segments": [
    {
      "segment_id": 1,
      "source_start": "00:02:15.527",
      "source_end": "00:02:36.846",
      "script_text": "Tuyền bà cá thì anh chỉ cũng không có như giả gì a cartoon character and a woman in a room"
    },
    {
      "segment_id": 2,
      "source_start": "00:03:49.602",
      "source_end": "00:03:56.724",
      "script_text": "Đôi chả có gì bỏ vụng làm sao a cartoon character sitting on the ground"
    }
  ]
}
