{
  "title": "Mùa Thu Và Những Lời Hứa",
  "plot_summary": "Trong một tháng, hai người bạn gặp nhau tại bàn ăn. Họ nói về việc kiếm sống và tiền bạc. Một hôm, chú Nam không còn gà để nuôi con châu nữa. Cuối cùng, họ nhận ra rằng không nên quá lo lắng về những điều nhỏ bé.",
  "moral_lesson": "Không nên quá lo lắng về những điều nhỏ bé, vì cuối cùng chúng ta sẽ nhận ra rằng những điều đó không quan trọng như chúng ta nghĩ.",
  "segments": [
    {
      "segment_id": 1,
      "source_start": "00:02:15.527",
      "source_end": "00:02:36.846",
      "script_text": "Tiền bà cá thì anh chỉ cũng không có như giả gì a cartoon character and a woman in a room"
    },
    {
      "segment_id": 2,
      "source_start": "00:03:49.602",
      "source_end": "00:03:56.724",
      "script_text": "Đôi, trả có gì bỏ buồn làm sao đây, chắc muối mặt sang nhận hai giúp nữa thôi a cartoon character sitting on the ground"
    }
  ]
}
