{
  "title": "Mùa Thu",
  "plot_summary": "Trong một tháng, hai người bạn ngồi ăn thịt gà và thảo luận về việc kiếm sống. Họ gặp nhiều khó khăn nhưng vẫn luôn lạc quan và tìm cách giải quyết. Cuối cùng họ nhận ra rằng không cần quá lo lắng vì tất cả đều là sự thật.",
  "moral_lesson": "Khi gặp khó khăn, hãy lạc quan và tìm cách giải quyết thay vì lo lắng quá mức.",
  "segments": [
    {
      "segment_id": 1,
      "source_start": "00:02:15.527",
      "source_end": "00:02:36.846",
      "script_text": "Tuyền bà cá thì anh chỉ cũng không có như giả gì a cartoon character and a woman in a room"
    },
    {
      "segment_id": 2,
      "source_start": "00:03:49.602",
      "source_end": "00:03:56.724",
      "script_text": "Đôi chả có gì bỏ vụng làm sao a cartoon character sitting on the ground"
    }
  ]
}
